AJArabic	Thu Jun 14 15:00:04 +0000 2018	هل ستتوافق القراءة الفلكية مع الرؤية الشرعية التقليدية في أن يكون العيد يوم غد الجمعة؟ <a href="https://t.co/aK0PpNxPQk" target="_blank">Read More &nbsp;</a>	
AJArabic	Thu Jun 14 14:22:41 +0000 2018	حشدوا وصوتوا للملف الثلاثي الأمريكي المكسيكي الكندي ضد الشقيق المغربي.. هل أصبحت الولايات المتحدة عربية؟ <a href="https://t.co/AdziVGZB7S" target="_blank">Read More &nbsp;</a>	https://pbs.twimg.com/media/DfqH9i9UEAAW5cZ.jpg
AJArabic	Thu Jun 14 13:30:10 +0000 2018	الكاتب قال إنه بعد ساعات من محادثة أمير دولة #قطر لملك #الأردن، وربما لأنه عَلِم بهذه المحادثة، هاتف الملك سلمان ال… <a href="https://t.co/zCGerQ1V9S" target="_blank">Read More &nbsp;</a>	
AJArabic	Thu Jun 14 13:00:01 +0000 2018	وزير الخارجية اليمني: باب الدبلوماسية أغلق تماماً كما أن عملية تحرير #الحديدة لن تتوقف حتى يتم تحرير كامل الأراضي ا… <a href="https://t.co/2cHvchfWeI" target="_blank">Read More &nbsp;</a>	
AJArabic	Thu Jun 14 12:30:13 +0000 2018	وزارة الخارجية الروسية: المدنيون في #اليمن سيكونون على حافة الموت إذا أدى القتال إلى إغلاق قناة الإمداد بالمواد الط… <a href="https://t.co/eSiY50inNt" target="_blank">Read More &nbsp;</a>	
AJArabic	Thu Jun 14 11:30:11 +0000 2018	موقع ميديابارت: هل يرى ماكرون فعلا أن تطوير المستوطنات بوتيرة سريعة، وبمشاركة ثلاث شركات فرنسية يتفق مع الموقف الذي… <a href="https://t.co/mpaABrS9Xo" target="_blank">Read More &nbsp;</a>	
AJArabic	Thu Jun 14 11:00:01 +0000 2018	#قطر المحاصرة من #السعودية والإمارات والبحرين، تمد يد الاخوة إلى #الأردن، وتقدم دعما ماليا وموقفا اقتصاديا لتعزيز ص… <a href="https://t.co/5ETSMBqFfP" target="_blank">Read More &nbsp;</a>	
AJArabic	Thu Jun 14 10:31:03 +0000 2018	الطالبة انتحرت عن طريق تناول حبوب سامة ووصلت جثة هامدة إلى مستشفى بمحافظة الدقهلية شمال شرق البلاد… <a href="https://t.co/5sfaFE8OAr" target="_blank">Read More &nbsp;</a>	
AJArabic	Thu Jun 14 10:02:39 +0000 2018	وزير الخارجية اللبناني في حكومة تصريف الأعمال: ينبغي تشجيع وتسريع العودة الآمنة للاجئين السوريين إلى بلادهم <a href="https://t.co/6XNeqQ7oiS" target="_blank">Read More &nbsp;</a>	https://pbs.twimg.com/amplify_video_thumb/1007200594505822208/img/kmabm_ZJ00blZBbC.jpg
AJArabic	Thu Jun 14 09:30:14 +0000 2018	بعد واقعة المونديال.. هل ستتأثر علاقات #الرباط و #الرياض؟ <a href="https://t.co/AEB05bWY8k" target="_blank">Read More &nbsp;</a> الرابط البديل:… <a href="https://t.co/e81dkS5SfY" target="_blank">Read More &nbsp;</a>	
AJArabic	Thu Jun 14 09:00:11 +0000 2018	عبد الله الغامدي: هذه الاعتقالات التعسفية تساندها منظومة عدلية تتلخص فيها وظيفة القاضي بالاستماع لإفادة الأجهزة الأ… <a href="https://t.co/sPJjPYGTVj" target="_blank">Read More &nbsp;</a>	
AJArabic	Thu Jun 14 08:30:00 +0000 2018	الجمعية العامة للأمم المتحدة تدين #إسرائيل وتقر حماية الفلسطينيين <a href="https://t.co/6NtozCGuXg" target="_blank">Read More &nbsp;</a>	https://pbs.twimg.com/amplify_video_thumb/1007152084968341505/img/Dyr2eKdox_IbLFB5.jpg
AJArabic	Thu Jun 14 08:00:04 +0000 2018	اللجنة الدولية للصليب الأحمر أكدت أن الحاجة ملحة حاليا لفتح مطار #صنعاء لأغراض إنسانية وإجلاء المدنيين، محذّرة من أ… <a href="https://t.co/1ch0fAeRIS" target="_blank">Read More &nbsp;</a>	
AJArabic	Thu Jun 14 07:30:00 +0000 2018	موقع ميدل إيست آي: #الإمارات أجبرت هادي على تأييد الهجوم على #الحديدة رغما عنه <a href="https://t.co/nZujr5gO2n" target="_blank">Read More &nbsp;</a>	https://pbs.twimg.com/amplify_video_thumb/1007146145460584449/img/skWqKdleu2ouQi61.jpg
